<?xml version="1.0" encoding="ISO-8859-1"?>
<?xml-stylesheet type="text/xsl" href="xs\KPI.xsl" ?>
<KPI xmlns:xsd="http://www.w3.org/2001/XMLSchema-instance" xsd:schemaLocation="/xs/KPI.xsd">
  <ID>KPID009</ID>
  <ALIAS>Risikokapital Gesamt</ALIAS>
  <COMMENT></COMMENT>
  <TITEL>IRM EPR Kennzahlkatalog</TITEL>
  <STAND>24.6.11</STAND>
  <TYPE>Calculated</TYPE>
  <CALC>
    <CHILD>
      <SIGN>+</SIGN>
      <ALIAS>Diversifikation über Erst- und Rückversicherung</ALIAS>
      <LINK>KPIR010</LINK>
    </CHILD>
    <CHILD>
      <SIGN>+</SIGN>
      <ALIAS>Diversifikation über Segmente</ALIAS>
      <LINK>KPIR009</LINK>
    </CHILD>
    <CHILD>
      <SIGN>+</SIGN>
      <ALIAS>Diversifikation über Gesellschaften</ALIAS>
      <LINK>KPIR008</LINK>
    </CHILD>
    <CHILD>
      <SIGN>+</SIGN>
      <ALIAS>Diversifikation über Risikoarten</ALIAS>
      <LINK>KPID008</LINK>
    </CHILD>
    <CHILD>
      <SIGN>+</SIGN>
      <ALIAS>Operationale Risiken</ALIAS>
      <LINK>RK04</LINK>
    </CHILD>
    <CHILD>
      <SIGN>+</SIGN>
      <ALIAS>VT</ALIAS>
      <LINK>RK03</LINK>
    </CHILD>
    <CHILD>
      <SIGN>+</SIGN>
      <ALIAS>Kredit</ALIAS>
      <LINK>RK02</LINK>
    </CHILD>
    <CHILD>
      <SIGN>+</SIGN>
      <ALIAS>Markt</ALIAS>
      <LINK>RK01</LINK>
    </CHILD>
  </CALC>
  <RULES>
  </RULES>
  <USED>
    <BY>
      <ALIAS>Risikokapital Gesamt Durchschnitt</ALIAS>
      <LINK>KPID009M</LINK>
    </BY>
    <BY>
      <ALIAS>Gebundenes überschüssiges Kapital</ALIAS>
      <LINK>KPID042</LINK>
    </BY>
    <BY>
      <ALIAS>Risikokapital Gruppensicht</ALIAS>
      <LINK>KPID010</LINK>
    </BY>
  </USED>
</KPI>
