<?xml version="1.0" encoding="ISO-8859-1"?>
<?xml-stylesheet type="text/xsl" href="xs\KPI.xsl" ?>

<KPI xmlns:xsd="http://www.w3.org/2001/XMLSchema-instance" xsd:schemaLocation="/xs/KPI.xsd">
  
  <ID>MCEV01</ID>
  
  <TITEL>Subsummierter Steuersatz</TITEL>
  
  <ALIAS>MCEV 1.1. GJ ohne Frictional CoC</ALIAS>
  
  <COMMENT>Lorem ipsum dolor sit amet, consetetur sadipscing elitr, sed diam nonumy eirmod tempor invidunt ut labore et dolore magna aliquyam erat, sed diam voluptua. At vero eos et accusam et justo duo dolores et ea rebum. Stet clita kasd gubergren, no sea takimata sanctus est Lorem ipsum dolor sit amet. Lorem ipsum dolor sit amet, consetetur sadipscing elitr, sed diam nonumy eirmod tempor invidunt ut labore et dolore magna aliquyam erat, sed diam voluptua. At vero eos et accusam et justo duo dolores et ea rebum. Stet clita kasd gubergren, no sea takimata sanctus est Lorem ipsum dolor sit amet. Lorem ipsum dolor sit amet, consetetur sadipscing elitr, sed diam nonumy eirmod tempor invidunt ut labore et dolore magna aliquyam erat, sed diam voluptua. At vero eos et accusam et justo duo dolores et ea rebum. Stet clita kasd gubergren, no sea takimata sanctus est Lorem ipsum dolor sit amet.   Duis autem vel eum iriure dolor in hendrerit in vulputate velit esse molestie consequat, vel illum dolore eu feugiat nulla facilisis at vero eros et accumsan et iusto odio dignissim qui blandit praesent luptatum zzril delenit augue duis dolore te feugait nulla facilisi. Lorem ipsum dolor sit amet, consectetuer adipiscing elit, sed diam nonummy nibh euismod tincidunt ut laoreet dolore magna aliquam erat volutpat.   Ut wisi enim ad minim veniam, quis nostrud exerci tation ullamcorper suscipit lobortis nisl ut aliquip ex ea commodo consequat. Duis autem vel eum iriure dolor in hendrerit in vulputate velit esse molestie consequat, vel illum dolore eu feugiat nulla facilisis at vero eros et accumsan et iusto odio dignissim qui blandit praesent luptatum zzril delenit augue duis dolore te feugait nulla facilisi.   Nam liber tempor cum soluta nobis eleifend option congue nihil imperdiet doming id quod mazim placerat facer possim assum. Lorem ipsum dolor sit amet, consectetuer adipiscing elit, sed diam nonummy nibh euismod tincidunt ut laoreet dolore magna aliquam erat volutpat. Ut wisi enim ad minim veniam, quis nostrud exerci tation ullamcorper suscipit lobortis nisl ut aliquip ex ea commodo consequat.   Duis autem vel eum iriure dolor in hendrerit in vulputate velit esse molestie consequat, vel illum dolore eu feugiat nulla facilisis.   At vero eos et accusam et justo duo dolores et ea rebum. Stet clita kasd gubergren, no sea takimata sanctus est Lorem ipsum dolor sit amet. Lorem ipsum dolor sit amet, consetetur sadipscing elitr, sed diam nonumy eirmod tempor invidunt ut labore et dolore magna aliquyam erat, sed diam voluptua. At vero eos et accusam et justo duo dolores et ea rebum. Stet clita kasd gubergren, no sea takimata sanctus est Lorem ipsum dolor sit amet. Lorem ipsum dolor sit amet, consetetur sadipscing elitr, At accusam aliquyam diam diam dolore dolores duo eirmod eos erat, et nonumy sed tempor et et invidunt justo labore Stet clita ea et gubergren, kasd magna no rebum. sanctus sea sed takimata ut vero voluptua. est Lorem ipsum dolor sit amet. Lorem ipsum dolor sit amet, consetetur sadipscing elitr, sed diam nonumy eirmod tempor invidunt ut labore et dolore magna aliquyam erat. </COMMENT>

  <TYPE>Input</TYPE>

  <STAND></STAND>



  <RULES>
    <RULE>
<PART type="normal"></PART>
<PART type="Link">KPIR006</PART>
<PART type="normal">
=IF(</PART>
<PART type="Source">MCEV01</PART>
<PART type="normal">
 =0,0,IF(SUBST(!EPR_Segmente,1,7)@='Segment',STET,IF(</PART>
<PART type="Link">EK03</PART>
<PART type="normal">
=0,</PART>
<PART type="Link">ECON201</PART>
<PART type="normal">
,</PART>
<PART type="Link">EK03</PART>
<PART type="normal">
)));</PART></RULE>
    
    
    
    <RULE><PART type="normal"></PART>
<PART type="Link">KPID069</PART>
<PART type="normal">
=IF(SUBST(!EPR_Segmente,1,7)@='Segment',STET,IF(</PART>
<PART type="Source">MCEV01</PART>
<PART type="normal">
 =0,0,</PART>
<PART type="Link">EK10</PART>
<PART type="normal">
-</PART>
<PART type="Link">EK03VJ</PART>
<PART type="normal">
+</PART>
<PART type="Link">KPIR006VJ</PART>
<PART type="normal">
));</PART></RULE>
    <RULE><PART type="normal"></PART>
<PART type="Link">KPID020</PART>
<PART type="normal">
=IF(</PART>
<PART type="Source">MCEV01</PART>
<PART type="normal">
 =0,0,</PART>
<PART type="Link">MCEV33</PART>
<PART type="normal">
-</PART>
<PART type="Link">KPIR006</PART>
<PART type="normal">
);</PART></RULE> 
  <RULE><PART type="normal"></PART>
<PART type="Link">KPIR041</PART>
<PART type="normal">
=IF(SUBST(!EPR_Segmente,1,7)@='Segment',STET,IF(</PART>
<PART type="Source">MCEV01</PART>
<PART type="normal">
 =0,0,</PART>
<PART type="Link">MVM</PART>
<PART type="normal">
));</PART></RULE>
<RULE><PART type="normal"></PART>
<PART type="Link">MCEV33</PART>
<PART type="normal">
=IF(</PART>
<PART type="Source">MCEV01</PART>
<PART type="normal">
 =0,0,</PART>
<PART type="Link">MCEV29</PART>
<PART type="normal">
+</PART>
<PART type="Link">KPIR041</PART>
<PART type="normal">
);</PART></RULE>
<RULE><PART type="normal"></PART>
<PART type="Link">KPID002</PART>
<PART type="normal">
=IF(</PART>
<PART type="Source">MCEV01</PART>
<PART type="normal">
 =0,0,</PART>
<PART type="Link">MCEV33</PART>
<PART type="normal">
-</PART>
<PART type="Source">MCEV01</PART>
<PART type="normal">
);</PART></RULE>
  </RULES>
    <USED>
    <BY>
      <ALIAS>MCEV 31.12. GJ (vor Div.abfluss und Kapitalmaﬂnahmen)</ALIAS>
      <LINK>MCEV27</LINK>
    </BY>
    <BY>
      <ALIAS>Delta MCEV (ohne Abzug FricCoC)</ALIAS>
      <LINK>KPID002</LINK>
    </BY>
    <BY>
      <ALIAS>MCEV-Uplift 1.1.</ALIAS>
      <LINK>KPID020H</LINK>
    </BY>
  </USED>
</KPI>
