<?xml version="1.0" encoding="ISO-8859-1"?>
<?xml-stylesheet type="text/xsl" href="xs\KPI.xsl" ?>
<KPI xmlns:xsd="http://www.w3.org/2001/XMLSchema-instance" xsd:schemaLocation="/xs/KPI.xsd">
  <ID>KPID009M</ID>
  <ALIAS>Risikokapital Gesamt Durchschnitt</ALIAS>
  <COMMENT></COMMENT>
  <TITEL>IRM EPR Kennzahlkatalog</TITEL>
  <STAND>24.6.11</STAND>
  <TYPE>Calculated</TYPE>
  <CALC>
    <CHILD>
      <SIGN>0,5*</SIGN>
      <ALIAS>Risikokapital Gesamt 1.1.</ALIAS>
      <LINK>KPID009VJ</LINK>
    </CHILD>
    <CHILD>
      <SIGN>+0,5*</SIGN>
      <ALIAS>Risikokapital Gesamt</ALIAS>
      <LINK>KPID009</LINK>
    </CHILD>
  </CALC>
  <RULES>
<RULE><PART type="normal"></PART>
<PART type="Link">KPIR025</PART>
<PART type="normal">
=IF((</PART>
<PART type="Source">KPID009M</PART>
<PART type="normal">
-</PART>
<PART type="Link">KPID014</PART>
<PART type="normal">
)=0,0,(</PART>
<PART type="Link">KPID027</PART>
<PART type="normal">
-</PART>
<PART type="Link">KPIR019b</PART>
<PART type="normal">
)/(</PART>
<PART type="Source">KPID009M</PART>
<PART type="normal">
-</PART>
<PART type="Link">KPID014</PART>
<PART type="normal">
));</PART></RULE>
<RULE><PART type="normal"></PART>
<PART type="Link">KPIR026</PART>
<PART type="normal">
=IF((</PART>
<PART type="Source">KPID009M</PART>
<PART type="normal">
-</PART>
<PART type="Link">KPID014</PART>
<PART type="normal">
)=0,0,(</PART>
<PART type="Link">EK07</PART>
<PART type="normal">
-</PART>
<PART type="Link">KPIR019b</PART>
<PART type="normal">
)/(</PART>
<PART type="Source">KPID009M</PART>
<PART type="normal">
-</PART>
<PART type="Link">KPID014</PART>
<PART type="normal">
));</PART></RULE>
<RULE><PART type="normal"></PART>
<PART type="Link">KPIR027</PART>
<PART type="normal">
=(</PART>
<PART type="Link">KPID019aM</PART>
<PART type="normal">
+</PART>
<PART type="Link">KPID019bM</PART>
<PART type="normal">
)/(</PART>
<PART type="Source">KPID009M</PART>
<PART type="normal">
+</PART>
<PART type="Link">KPID041M</PART>
<PART type="normal">
);</PART></RULE>
<RULE><PART type="normal"></PART>
<PART type="Link">KPIR039</PART>
<PART type="normal">
=</PART>
<PART type="Link">KPID054</PART>
<PART type="normal">
/</PART>
<PART type="Source">KPID009M</PART>
<PART type="normal">
;</PART></RULE>
<RULE><PART type="normal"></PART>
<PART type="Link">KPIR040</PART>
<PART type="normal">
=</PART>
<PART type="Link">KPID065</PART>
<PART type="normal">
/</PART>
<PART type="Source">KPID009M</PART>
<PART type="normal">
;</PART></RULE>
<RULE><PART type="normal"></PART>
<PART type="Link">KPID038M</PART>
<PART type="normal">
=</PART>
<PART type="Link">CC00M</PART>
<PART type="normal">
-</PART>
<PART type="Source">KPID009M</PART>
<PART type="normal">
;</PART></RULE>
  </RULES>
  <USED>
    <BY>
      <ALIAS>Risikokapital Gruppensicht Durchschnitt</ALIAS>
      <LINK>KPID061</LINK>
    </BY>
    <BY>
      <ALIAS>Gebundenes überschüssiges Kapital Durchschnitt</ALIAS>
      <LINK>KPID038M</LINK>
    </BY>
  </USED>
</KPI>
