<?xml version="1.0" encoding="ISO-8859-1"?>
<?xml-stylesheet type="text/xsl" href="xs\KPI.xsl" ?>
<KPI xmlns:xsd="http://www.w3.org/2001/XMLSchema-instance" xsd:schemaLocation="/xs/KPI.xsd">
  <ID>KPID061</ID>
  <ALIAS>Risikokapital Gruppensicht Durchschnitt</ALIAS>
  <COMMENT>WRS-Kennzahl</COMMENT>
  <TITEL>IRM EPR Kennzahlkatalog</TITEL>
  <STAND>24.6.11</STAND>
  <TYPE>Calculated</TYPE>
  <CALC>
    <CHILD>
      <SIGN>+</SIGN>
      <ALIAS>Diversifikation über Erst- und Rückversicherung</ALIAS>
      <LINK>KPIR010</LINK>
    </CHILD>
    <CHILD>
      <SIGN>+</SIGN>
      <ALIAS>Risikokapital Gesamt Durchschnitt</ALIAS>
      <LINK>KPID009M</LINK>
    </CHILD>
  </CALC>
  <RULES>
  </RULES>
  <USED>
  </USED>
</KPI>
