<?xml version="1.0" encoding="ISO-8859-1"?>
<?xml-stylesheet type="text/xsl" href="xs\KPI.xsl" ?>
<KPI xmlns:xsd="http://www.w3.org/2001/XMLSchema-instance" xsd:schemaLocation="/xs/KPI.xsd">
  <ID>KPID038M</ID>
  <ALIAS>Gebundenes überschüssiges Kapital Durchschnitt</ALIAS>
  <COMMENT></COMMENT>
  <TITEL>IRM EPR Kennzahlkatalog</TITEL>
  <STAND>24.6.11</STAND>
  <TYPE>Calculated</TYPE>
  <CALC>
    <CHILD>
      <SIGN>-</SIGN>
      <ALIAS>Risikokapital Gesamt Durchschnitt</ALIAS>
      <LINK>KPID009M</LINK>
    </CHILD>
    <CHILD>
      <SIGN>+</SIGN>
      <ALIAS>Betriebsnotwendiges Eigenkapital inkl. Tol. (SRMF) Durchschnitt</ALIAS>
      <LINK>CC00M</LINK>
    </CHILD>
  </CALC>
  <RULES>
<RULE><PART type="normal"></PART>
<PART type="Source">KPID038M</PART>
<PART type="normal">
=</PART>
<PART type="Link">CC00M</PART>
<PART type="normal">
-</PART>
<PART type="Link">KPID009M</PART>
<PART type="normal">
;</PART></RULE>
  </RULES>
  <USED>
  </USED>
</KPI>
