<?xml version="1.0" encoding="ISO-8859-1"?>
<?xml-stylesheet type="text/xsl" href="xs\KPI.xsl" ?>
<KPI xmlns:xsd="http://www.w3.org/2001/XMLSchema-instance" xsd:schemaLocation="/xs/KPI.xsd">
  <ID>STSZ2</ID>
  <ALIAS>subsumierter Steuersatz</ALIAS>
  <COMMENT>Ist kein STSZ angegeben, wird der Wert von ERGO-Ebene genommen.</COMMENT>
  <TITEL>IRM EPR Kennzahlkatalog</TITEL>
  <STAND>24.6.11</STAND>
  <TYPE>Input</TYPE>
  <RULES>
<RULE><PART type="normal"></PART>
<PART type="Link">KPIR014</PART>
<PART type="normal">
=</PART>
<PART type="Link">KPID015</PART>
<PART type="normal">
*(1-</PART>
<PART type="Source">STSZ2</PART>
<PART type="normal">
);</PART></RULE>
<RULE><PART type="normal"></PART>
<PART type="Link">KPIR015</PART>
<PART type="normal">
=</PART>
<PART type="Link">Zi00</PART>
<PART type="normal">
*(1-</PART>
<PART type="Source">STSZ2</PART>
<PART type="normal">
);</PART></RULE>
<RULE><PART type="normal"></PART>
<PART type="Link">KPIR023</PART>
<PART type="normal">
=IF(</PART>
<PART type="Link">STSZ</PART>
<PART type="normal">
=0,IF(SUBST(!EPR_Segmente,1,7)@='Segment',STET,(</PART>
<PART type="Link">KA21</PART>
<PART type="normal">
-</PART>
<PART type="Link">KA17</PART>
<PART type="normal">
)*(1-</PART>
<PART type="Source">STSZ2</PART>
<PART type="normal">
)),(</PART>
<PART type="Link">KA21</PART>
<PART type="normal">
-</PART>
<PART type="Link">KA17</PART>
<PART type="normal">
)*(1-</PART>
<PART type="Link">STSZ</PART>
<PART type="normal">
));</PART></RULE>
<RULE><PART type="normal"></PART>
<PART type="Link">KPIR033</PART>
<PART type="normal">
=IF(</PART>
<PART type="Link">STSZ</PART>
<PART type="normal">
=0,IF(SUBST(!EPR_Segmente,1,7)@='Segment',STET,</PART>
<PART type="Link">PR01</PART>
<PART type="normal">
*(1-</PART>
<PART type="Source">STSZ2</PART>
<PART type="normal">
)),</PART>
<PART type="Link">PR01</PART>
<PART type="normal">
*(1-</PART>
<PART type="Link">STSZ</PART>
<PART type="normal">
));</PART></RULE>
<RULE><PART type="normal"></PART>
<PART type="Link">KPIR037</PART>
<PART type="normal">
=</PART>
<PART type="Link">KPIR033D</PART>
<PART type="normal">
/(1-</PART>
<PART type="Source">STSZ2</PART>
<PART type="normal">
);</PART></RULE>
<RULE><PART type="normal"></PART>
<PART type="Link">KPIR032</PART>
<PART type="normal">
=</PART>
<PART type="Link">KPID048</PART>
<PART type="normal">
*(1-</PART>
<PART type="Source">STSZ2</PART>
<PART type="normal">
);</PART></RULE>
<RULE><PART type="normal"></PART>
<PART type="Source">STSZ2</PART>
<PART type="normal">
=IF(</PART>
<PART type="Link">STSZ</PART>
<PART type="normal">
=0,</PART>
<PART type="Link">STSZ','Eingabe Segment ERGO</PART>
<PART type="normal">
,</PART>
<PART type="Link">STSZ</PART>
<PART type="normal">
);</PART></RULE>
  </RULES>
  <USED>
  </USED>
</KPI>
